{
  "$defs": {
    "ShapleyMetricV1": {
      "additionalProperties": false,
      "properties": {
        "efficiency_max_abs_residual": {
          "minimum": 0.0,
          "title": "Efficiency Max Abs Residual",
          "type": "number"
        },
        "scenarios_attributed": {
          "minimum": 0,
          "title": "Scenarios Attributed",
          "type": "integer"
        },
        "values": {
          "additionalProperties": {
            "type": "number"
          },
          "title": "Values",
          "type": "object"
        }
      },
      "required": [
        "values",
        "efficiency_max_abs_residual",
        "scenarios_attributed"
      ],
      "title": "ShapleyMetricV1",
      "type": "object"
    }
  },
  "$schema": "https://json-schema.org/draft/2020-12/schema",
  "additionalProperties": false,
  "properties": {
    "cohort_manifest_sha256": {
      "pattern": "^[0-9a-f]{64}$",
      "title": "Cohort Manifest Sha256",
      "type": "string"
    },
    "cohort_size": {
      "minimum": 0,
      "title": "Cohort Size",
      "type": "integer"
    },
    "common_valid_tokens": {
      "minimum": 0,
      "title": "Common Valid Tokens",
      "type": "integer"
    },
    "metrics": {
      "additionalProperties": {
        "$ref": "#/$defs/ShapleyMetricV1"
      },
      "title": "Metrics",
      "type": "object"
    },
    "protocol_sha256": {
      "pattern": "^[0-9a-f]{64}$",
      "title": "Protocol Sha256",
      "type": "string"
    },
    "schema_version": {
      "const": "aeb-shapley/v1",
      "title": "Schema Version",
      "type": "string"
    }
  },
  "required": [
    "schema_version",
    "protocol_sha256",
    "cohort_manifest_sha256",
    "cohort_size",
    "common_valid_tokens",
    "metrics"
  ],
  "title": "AEBShapleyV1",
  "type": "object"
}
